5;610323000080;6103.23;-- De fibras sintéticas;Men's or boys' ensembles of synthetic fibres, knitted or crocheted (excl. ski ensembles and swimwear);Ensembles en bonneterie, de fibres synthétiques, pour hommes ou garçonnets (sauf ensembles de ski, maillots, culottes et slips de bain);Kombinationen aus Gewirken oder Gestricken aus synthetischen Chemiefasern, für Männer oder Knaben (ausg. Skikombinationen und Badebekleidung)
5;610329000080;6103.29;-- De las demás materias textiles;Men's or boys' ensembles of textile materials (excl. wool, fine animal hair, cotton or synthetic fibres, ski ensembles and swimwear);Ensembles en bonneterie, de matières textiles, pour hommes et garçonnets (sauf de laine, poils fins, coton, fibres synthétiques et sauf ensembles de ski, maillots, culottes et slips de bain);Kombinationen aus Gewirken oder Gestricken aus Spinnstoffen, für Männer oder Knaben (ausg. aus Wolle oder feinen Tierhaaren, Baumwolle oder aus synthetischen Chemiefasern sowie Skikombinationen und Badebekleidung)
4;610331000010;;- Chaquetas (sacos);;;
5;610331000080;6103.31;-- De lana o pelo fino;Men's or boys' jackets and blazers of wool or fine animal hair, knitted or crocheted (excl. wind-jackets and similar articles);Vestons en bonneterie, de laine ou poils fins, pour hommes ou garçonnets (sauf anoraks et articles simil.);Jacken aus Gewirken oder Gestricken aus Wolle oder feinen Tierhaaren, für Männer oder Knaben (ausg. Windjacken und ähnl. Waren)
5;610332000080;6103.32;-- De algodón;Men's or boys' jackets and blazers of cotton, knitted or crocheted (excl. wind-jackets and similar articles);Vestons en bonneterie, de coton, pour hommes ou garçonnets (sauf anoraks et articles simil.);Jacken aus Gewirken oder Gestricken aus Baumwolle, für Männer oder Knaben (ausg. Windjacken und ähnl. Waren)
5;610333000080;6103.33;-- De fibras sintéticas;Men's or boys' jackets and blazers of synthetic fibres, knitted or crocheted (excl. wind-jackets and similar articles);Vestons en bonneterie, de fibres synthétiques, pour hommes ou garçonnets (sauf anoraks et articles simil.);Jacken aus Gewirken oder Gestricken aus synthetischen Chemiefasern, für Männer oder Knaben (ausg. Windjacken und ähnl. Waren)
5;610339000080;6103.39;-- De las demás materias textiles;Men's or boys' jackets and blazers of textile materials (excl. of wool, fine animal hair, cotton or synthetic fibres, wind-jackets and similar articles);Vestons en bonneterie, de matières textiles, pour hommes ou garçonnets (sauf de laine, poils fins, coton, fibres synthétiques et sauf anoraks et articles simil.);Jacken aus Gewirken oder Gestricken aus Spinnstoffen, für Männer oder Knaben (ausg. aus Wolle oder feinen Tierhaaren, Baumwolle oder synthetischen Chemiefasern sowie Windjacken und ähnl. Waren)
4;610341000010;;- Pantalones largos, pantalones con peto, pantalones cortos (calzones) y shorts;;;
5;610341000080;6103.41;-- De lana o pelo fino;Men's or boys' trousers, bib and brace overalls, breeches and shorts of wool or fine animal hair, knitted or crocheted (excl. swimwear and underpants);Pantalons, y.c. knickers et pantalons simil., salopettes à bretelles, culottes et shorts en bonneterie, de laine ou poils fins, pour hommes ou garçonnets (sauf caleçons et slips de bain);"Hosen, lang ""einschl. Kniebundhosen und ähnl. Hosen"", Latzhosen und kurze Hosen, aus Gewirken oder Gestricken aus Wolle oder feinen Tierhaaren, für Männer oder Knaben (ausg. Unterhosen und Badehosen)"
5;610342000080;6103.42;-- De algodón;Men's or boys' trousers, bib and brace overalls, breeches and shorts of cotton, knitted or crocheted (excl. swimwear and underpants);Pantalons, y.c. knickers et pantalons simil., salopettes à bretelles, culottes et shorts, en bonneterie, de coton, pour hommes ou garçonnets (sauf caleçons et slips de bain);"Hosen, lang ""einschl. Kniebundhosen und ähnl. Hosen"", Latzhosen und kurze Hosen, aus Gewirken oder Gestricken aus Baumwolle, für Männer oder Knaben (ausg. Unterhosen und Badehosen)"
5;610343000080;6103.43;-- De fibras sintéticas;Men's or boys' trousers, bib and brace overalls, breeches and shorts of synthetic fibres, knitted or crocheted (excl. swimwear and underpants);Pantalons, y.c. knickers et pantalons simil., salopettes à bretelles, culottes et shorts, en bonneterie, de fibres synthétiques, pour hommes ou garçonnets (sauf caleçons et slips de bain);"Hosen, lang ""einschl. Kniebundhosen und ähnl. Hosen"", Latzhosen und kurze Hosen, aus Gewirken oder Gestricken aus synthetischen Chemiefasern, für Männer oder Knaben (ausg. Unterhosen und Badehosen)"
5;610349000080;6103.49;-- De las demás materias textiles;Men's or boys' trousers, bib and brace overalls, breeches and shorts of textile materials, knitted or crocheted (excl. of wool, fine animal hair, cotton or synthetic fibres, swimwear and underpants);Pantalons, y.c. knickers et pantalons simil., salopettes à bretelles, culottes et shorts, en bonneterie, de matières textiles, pour hommes ou garçonnets (sauf de laine, poils fins, coton ou fibres synthétiques et sauf caleçons et slips de bain);"Hosen, lang ""einschl. Kniebundhosen und ähnl. Hosen"", Latzhosen und kurze Hosen, aus Gewirken oder Gestricken aus Spinnstoffen, für Männer oder Knaben (ausg. aus Wolle oder feinen Tierhaaren, Baumwolle oder synthetischen Chemiefasern sowie Unterhosen und Badehosen)"
3;610400000080;61.04; Trajes sastre, conjuntos, chaquetas (sacos), vestidos, faldas, faldas pantalón, pantalones largos, pantalones con peto, pantalones cortos (calzones) y shorts (excepto de baño), de punto, para mujeres o niñas;Women's or girls' suits, ensembles, jackets, blazers, dresses, skirts, divided skirts, trousers, bib and brace overalls, breeches and shorts, knitted or crocheted (excl. wind-jackets and similar articles, slips, petticoats and panties, tracksuits, ski suits and swimwear);Costumes tailleurs, ensembles, vestes, robes, jupes, jupes-culottes, pantalons, y.c. knickers et pantalons simil., salopettes à bretelles, culottes et shorts, en bonneterie, pour femmes ou fillettes (sauf anoraks et articles simil., combinaisons, fonds de robe, jupons, slips et culottes, survêtements de sport 'trainings', combinaisons et ensembles de ski et maillots, culottes et slips de bain);"Kostüme, Kombinationen, Jacken, Kleider, Röcke, Hosenröcke, lange Hosen ""einschl. Kniebundhosen und ähnl. Hosen"", Latzhosen und kurze Hosen, aus Gewirken oder Gestricken, für Frauen oder Mädchen (ausg. Windjacken und ähnl. Waren, Unterkleider, Unterröcke, Unterhosen, Trainingsanzüge, Skianzüge und Badebekleidung)"
4;610413000010;;- Trajes sastre;;;
5;610413000080;6104.13;-- De fibras sintéticas;Women's or girls' suits of synthetic fibres, knitted or crocheted (excl. ski overalls and swimwear);Costumes tailleurs en bonneterie, de fibres synthétiques, pour femmes ou fillettes (sauf combinaisons de ski et maillots, culottes et slips de bain);Kostüme aus Gewirken oder Gestricken aus synthetischen Chemiefasern, für Frauen oder Mädchen (ausg. Ski-Overalls und Badebekleidung)
5;610419000080;6104.19;-- De las demás materias textiles;Women's or girls' suits of textile materials, knitted or crocheted (excl. of synthetic fibres, and ski overalls and swimwear);Costumes tailleurs en bonneterie, de matières textiles, pour femmes ou fillettes (sauf de fibres synthétiques et à l'excl. des combinaisons de ski et maillots, des culottes et slips de bain);Kostüme aus Gewirken oder Gestricken aus Spinnstoffen, für Frauen oder Mädchen (ausg. aus synthetischen Chemiefasern sowie Ski-Overalls und Badebekleidung)
4;610422000010;;- Conjuntos;;;
5;610422000080;6104.22;-- De algodón;Women's or girls' ensembles of cotton, knitted or crocheted (excl. ski ensembles and swimwear);Ensembles en bonneterie, de coton, pour femmes ou fillettes (sauf ensembles de ski et maillots, culottes et slips de bain);Kombinationen aus Gewirken oder Gestricken aus Baumwolle, für Frauen oder Mädchen (ausg. Skikombinationen und Badebekleidung)
5;610423000080;6104.23;-- De fibras sintéticas;Women's or girls' ensembles of synthetic fibres, knitted or crocheted (excl. ski ensembles and swimwear);Ensembles en bonneterie, de fibres synthétiques, pour femmes ou fillettes (sauf ensembles de ski et maillots, culottes et slips de bain);Kombinationen aus Gewirken oder Gestricken aus synthetischen Chemiefasern, für Frauen oder Mädchen (ausg. Skikombinationen und Badebekleidung)
5;610429000080;6104.29;-- De las demás materias textiles;Women's or girls' ensembles of textile materials (excl. of cotton or synthetic fibres, ski ensembles and swimwear);Ensembles en bonneterie, de matières textiles, pour femmes et fillettes (sauf de coton, fibres synthétiques et à l'excl. d'ensembles de ski et maillots, des culottes et slips de bain);Kombinationen aus Gewirken oder Gestricken aus Spinnstoffen, für Frauen oder Mädchen (ausg. aus Baumwolle oder synthetischen Chemiefasern sowie Skikombinationen und Badebekleidung)
4;610431000010;;- Chaquetas (sacos);;;
5;610431000080;6104.31;-- De lana o pelo fino;Women's or girls' jackets and blazers of wool or fine animal hair, knitted or crocheted (excl. wind-jackets and similar articles);Vestes en bonneterie, de laine ou poils fins, pour femmes ou fillettes (sauf anoraks et articles simil.);Jacken aus Gewirken oder Gestricken aus Wolle oder feinen Tierhaaren, für Frauen oder Mädchen (ausg. Windjacken und ähnl. Waren)
5;610432000080;6104.32;-- De algodón;Women's or girls' jackets and blazers of cotton, knitted or crocheted (excl. wind-jackets and similar articles);Vestes en bonneterie, de coton, pour femmes ou fillettes (sauf anoraks et articles simil.);Jacken aus Gewirken oder Gestricken aus Baumwolle, für Frauen oder Mädchen (ausg. Windjacken und ähnl. Waren)
5;610433000080;6104.33;-- De fibras sintéticas;Women's or girls' jackets and blazers of synthetic fibres, knitted or crocheted (excl. wind-jackets and similar articles);Vestes en bonneterie, de fibres synthétiques, pour femmes ou fillettes (sauf anoraks et articles simil.);Jacken aus Gewirken oder Gestricken aus synthetischen Chemiefasern, für Frauen oder Mädchen (ausg. Windjacken und ähnl. Waren)
5;610439000080;6104.39;-- De las demás materias textiles;Women's or girls' jackets and blazers of textile materials, knitted or crocheted (excl. of wool, fine animal hair, cotton or synthetic fibres, wind-jackets and similar articles);Vestes en bonneterie, de matières textiles, pour femmes ou fillettes (sauf de laine, poils fins, coton ou fibres synthétiques et sauf anoraks et articles simil.);Jacken aus Gewirken oder Gestricken aus Spinnstoffen, für Frauen oder Mädchen (ausg. aus Wolle oder feinen Tierhaaren, Baumwolle oder synthetischen Chemiefasern sowie Windjacken und ähnl. Waren)
4;610441000010;;- Vestidos;;;
5;610441000080;6104.41;-- De lana o pelo fino;Women's or girls' dresses of wool or fine animal hair, knitted or crocheted (excl. petticoats);Robes en bonneterie, de laine ou poils fins, pour femmes ou fillettes (sauf combinaisons et fonds de robes);Kleider aus Gewirken oder Gestricken aus Wolle oder feinen Tierhaaren, für Frauen oder Mädchen (ausg. Unterkleider)
5;610442000080;6104.42;-- De algodón;Women's or girls' dresses of cotton, knitted or crocheted (excl. petticoats);Robes en bonneterie, de coton, pour femmes ou fillettes (sauf combinaisons et fonds de robes);Kleider aus Gewirken oder Gestricken aus Baumwolle, für Frauen oder Mädchen (ausg. Unterkleider)
5;610443000080;6104.43;-- De fibras sintéticas;Women's or girls' dresses of synthetic fibres, knitted or crocheted (excl. petticoats);Robes en bonneterie, de fibres synthétiques, pour femmes ou fillettes (sauf combinaisons et fonds de robes);Kleider aus Gewirken oder Gestricken aus synthetischen Chemiefasern, für Frauen oder Mädchen (ausg. Unterkleider)
5;610444000080;6104.44;-- De fibras artificiales;Women's or girls' dresses of artificial fibres, knitted or crocheted (excl. petticoats);Robes en bonneterie, de fibres artificielles, pour femmes ou fillettes (sauf combinaisons et fonds de robes);Kleider aus Gewirken oder Gestricken aus künstlichen Chemiefasern, für Frauen oder Mädchen (ausg. Unterkleider)
5;610449000080;6104.49;-- De las demás materias textiles;Women's or girls' dresses of textile materials, knitted or crocheted (excl. of wool, fine animal hair, cotton, man-made fibres and petticoats);Robes en bonneterie, de matières textiles, pour femmes ou fillettes (sauf de laine, poils fins, coton, fibres synthétiques ou artificielles et sauf combinaisons et fonds de robes);Kleider aus Gewirken oder Gestricken aus Spinnstoffen, für Frauen oder Mädchen (ausg. aus Wolle oder feinen Tierhaaren, Baumwolle oder Chemiefasern sowie Unterkleider)
4;610451000010;;- Faldas y faldas pantalón;;;
5;610451000080;6104.51;-- De lana o pelo fino;Women's or girls' skirts and divided skirts of wool or fine animal hair, knitted or crocheted (excl. petticoats);Jupes et jupes-culottes, en bonneterie, de laine ou poils fins, pour femmes ou fillettes (sauf jupons);Röcke und Hosenröcke, aus Gewirken oder Gestricken aus Wolle oder feinen Tierhaaren, für Frauen oder Mädchen (ausg. Unterröcke)
5;610452000080;6104.52;-- De algodón;Women's or girls' skirts and divided skirts of cotton, knitted or crocheted (excl. petticoats);Jupes et jupes-culottes, en bonneterie, de coton, pour femmes ou fillettes (sauf jupons);Röcke und Hosenröcke, aus Gewirken oder Gestricken aus Baumwolle, für Frauen oder Mädchen (ausg. Unterröcke)
5;610453000080;6104.53;-- De fibras sintéticas;Women's or girls' skirts and divided skirts of synthetic fibres, knitted or crocheted (excl. petticoats);Jupes et jupes-culottes, en bonneterie, de fibres synthétiques, pour femmes ou fillettes (sauf jupons);Röcke und Hosenröcke, aus Gewirken oder Gestricken aus synthetischen Chemiefasern, für Frauen oder Mädchen (ausg. Unterröcke)
5;610459000080;6104.59;-- De las demás materias textiles;Women's or girls' skirts and divided skirts of textile materials, knitted or crocheted (excl. of wool, fine animal hair, cotton or synthetic fibres, and petticoats);Jupes et jupes-culottes, en bonneterie, de matières textiles, pour femmes ou fillettes (sauf de laine, poils fins, coton, fibres synthétiques et sauf jupons);Röcke und Hosenröcke, aus Gewirken oder Gestricken aus Spinnstoffen, für Frauen oder Mädchen (ausg. aus Wolle oder feinen Tierhaaren, Baumwolle oder synthetischen Chemiefasern sowie Unterröcke)
4;610461000010;;- Pantalones largos, pantalones con peto, pantalones cortos (calzones) y shorts;;;
5;610461000080;6104.61;-- De lana o pelo fino;Women's or girls' trousers, bib and brace overalls, breeches and shorts of wool or fine animal hair, knitted or crocheted (excl. panties and swimwear);Pantalons, y.c. knickers et pantalons simil., salopettes à bretelles, culottes et shorts, en bonneterie, de laine ou poils fins, pour femmes ou fillettes (sauf slips et culottes et maillots, culottes et slips de bain);"Hosen, lang ""einschl. Kniebundhosen und ähnl. Hosen"", Latzhosen und kurze Hosen, aus Gewirken oder Gestricken aus Wolle oder feinen Tierhaaren, für Frauen oder Mädchen (ausg. Unterhosen und Badehosen)"
5;610462000080;6104.62;-- De algodón;Women's or girls' trousers, bib and brace overalls, breeches and shorts of cotton, knitted or crocheted (excl. panties and swimwear);Pantalons, y.c. knickers et pantalons simil., et culottes, salopettes à bretelles et shorts, en bonneterie, de coton, pour femmes ou fillettes (sauf slips et culottes et maillots, culottes et slips de bain);"Hosen, lang ""einschl. Kniebundhosen und ähnl. Hosen"", Latzhosen und kurze Hosen, aus Gewirken oder Gestricken aus Baumwolle, für Frauen oder Mädchen (ausg. Unterhosen und Badehosen)"
5;610463000080;6104.63;-- De fibras sintéticas;Women's or girls' trousers, bib and brace overalls, breeches and shorts of synthetic fibres, knitted or crocheted (excl. panties and swimwear);Pantalons, y.c. knickers et pantalons simil., et culottes, salopettes à bretelles et shorts, en bonneterie, de fibres synthétiques, pour femmes ou fillettes (sauf slips et maillots, culottes et slips de bain);"Hosen, lang ""einschl. Kniebundhosen und ähnl. Hosen"", Latzhosen und kurze Hosen, aus Gewirken oder Gestricken aus synthetischen Chemiefasern, für Frauen oder Mädchen (ausg. Unterhosen und Badehosen)"
5;610469000080;6104.69;-- De las demás materias textiles;Women's or girls' trousers, bib and brace overalls, breeches and shorts of textile materials, knitted or crocheted (excl. of wool, fine animal hair, cotton or synthetic fibres, panties and swimwear);Pantalons, y.c. knickers et pantalons simil., et culottes, salopettes à bretelles et shorts, en bonneterie, de matières textiles, pour femmes ou fillettes (sauf de laine, poils fins, coton, fibres synthétiques et sauf slips et maillots, culottes et slips de bain);"Hosen, lang ""einschl. Kniebundhosen und ähnl. Hosen"", Latzhosen und kurze Hosen, aus Gewirken oder Gestricken aus Spinnstoffen, für Frauen oder Mädchen (ausg. aus Wolle oder feinen Tierhaaren, Baumwolle oder synthetischen Chemiefasern sowie Unterhosen und Badehosen)"
3;610500000080;61.05; Camisas de punto para hombres o niños;Men's or boys' shirts, knitted or crocheted (excl. nightshirts, T-shirts, singlets and other vests);Chemises et chemisettes, en bonneterie, pour hommes ou garçonnets (sauf chemises de nuit, T-shirts et maillots de corps);Hemden aus Gewirken oder Gestricken, für Männer oder Knaben (ausg. Nachthemdem, T-Shirts und Unterhemden)
4;610510000080;6105.10;- De algodón;Men's or boys' shirts of cotton, knitted or crocheted (excl. nightshirts, T-shirts, singlets and other vests);Chemises et chemisettes, en bonneterie, de coton, pour hommes ou garçonnets (sauf chemises de nuit, T-shirts et maillots de corps);Hemden aus Gewirken oder Gestricken aus Baumwolle, für Männer oder Knaben (ausg. Nachthemdem, T-Shirts und Unterhemden)
4;610520000080;6105.20;- De fibras sintéticas o artificiales;Men's or boys' shirts of man-made fibres, knitted or crocheted (excl. nightshirts, T-shirts, singlets and other vests);Chemises et chemisettes, en bonneterie, de fibres synthétiques ou artificielles, pour hommes ou garçonnets (sauf chemises de nuit, T-shirts et maillots de corps);Hemden aus Gewirken oder Gestricken aus Chemiefasern, für Männer oder Knaben (ausg. Nachthemdem, T-Shirts und Unterhemden)
4;610590000080;6105.90;- De las demás materias textiles;Men's or boys' shirts of textile materials, knitted or crocheted (excl. of cotton or man-made fibres, nightshirts, T-shirts, singlets and other vests);Chemises et chemisettes, en bonneterie, de matières textiles, pour hommes ou garçonnets (sauf de coton, fibres synthétiques ou artificielles et sauf chemises de nuit, T-shirts et maillots de corps);Hemden aus Gewirken oder Gestricken aus Spinnstoffen, für Männer oder Knaben (ausg. aus Baumwolle oder Chemiefasern sowie Nachthemden, T-Shirts und Unterhemden)
3;610600000080;61.06; Camisas, blusas y blusas camiseras, de punto, para mujeres o niñas;Women's or girls' blouses, shirts and shirt-blouses, knitted or crocheted (excl. T-shirts and vests);Chemisiers, blouses, blouses-chemisiers et chemisettes, en bonneterie, pour femmes ou fillettes (sauf T-shirts et gilets de corps);Blusen und Hemdblusen, aus Gewirken oder Gestricken, für Frauen oder Mädchen (ausg. T-Shirts und Unterhemden)
4;610610000080;6106.10;- De algodón;Women's or girls' blouses, shirts and shirt-blouses of cotton, knitted or crocheted (excl. T-shirts and vests);Chemisiers, blouses, blouses-chemisiers et chemisettes, en bonneterie, de coton, pour femmes ou fillettes (sauf T-shirts et gilets de corps);Blusen und Hemdblusen, aus Gewirken oder Gestricken aus Baumwolle, für Frauen oder Mädchen (ausg. T-Shirts und Unterhemden)
4;610620000080;6106.20;- De fibras sintéticas o artificiales;Women's or girls' blouses, shirts and shirt-blouses of man-made fibres, knitted or crocheted (excl. T-shirts and vests);Chemisiers, blouses, blouses-chemisiers et chemisettes, en bonneterie, de fibres synthétiques ou artificielles, pour femmes ou fillettes (sauf T-shirts et gilets de corps);Blusen und Hemdblusen, aus Gewirken oder Gestricken aus Chemiefasern, für Frauen oder Mädchen (ausg. T-Shirts und Unterhemden)
4;610690000080;6106.90;- De las demás materias textiles;Women's or girls' blouses, shirts and shirt-blouses of textile materials, knitted or crocheted (excl. of cotton or man-made fibres, T-shirts and vests);Chemisiers, blouses, blouses-chemisiers et chemisettes, en bonneterie, de matières textiles, pour femmes ou fillettes (sauf de coton, fibres synthétiques ou artificielles et sauf T-shirts et gilets de corps);Blusen und Hemdblusen, aus Gewirken oder Gestricken aus Spinnstoffen, für Frauen oder Mädchen (ausg. aus Baumwolle oder Chemiefasern sowie T-Shirts und Unterhemden)
3;610700000080;61.07; Calzoncillos, incluidos los largos y los slips, camisones, pijamas, albornoces de baño, batas de casa y artículos similares, de punto, para hombres o niños;Men's or boys' underpants, briefs, nightshirts, pyjamas, bathrobes, dressing gowns and similar articles, knitted or crocheted (excl. vests and singlets);Slips, caleçons, chemises de nuit, pyjamas, peignoirs de bain, robes de chambre et articles simil., en bonneterie, pour hommes ou garçonnets (sauf maillots de corps);Slips und andere Unterhosen, Nachthemden, Schlafanzüge, Bademäntel und -jacken, Hausmäntel und ähnl. Waren, aus Gewirken oder Gestricken, für Männer oder Knaben (ausg. Unterhemden)
4;610711000010;;- Calzoncillos, incluidos los largos y los slips;;;
5;610711000080;6107.11;-- De algodón;Men's or boys' underpants and briefs of cotton, knitted or crocheted;Slips et caleçons, en bonneterie, de coton, pour hommes ou garçonnets;Slips und andere Unterhosen, aus Gewirken oder Gestricken aus Baumwolle, für Männer oder Knaben
5;610712000080;6107.12;-- De fibras sintéticas o artificiales;Men's or boys' underpants and briefs of man-made fibres, knitted or crocheted;Slips et caleçons, en bonneterie, de fibres synthétiques ou artificielles, pour hommes ou garçonnets;Slips und andere Unterhosen, aus Gewirken oder Gestricken aus Chemiefasern, für Männer oder Knaben
5;610719000080;6107.19;-- De las demás materias textiles;Men's or boys' underpants and briefs of other textile materials, knitted or crocheted (excl. of cotton or man-made fibres);Slips et caleçons, en bonneterie, de matières textiles, pour hommes ou garçonnets (sauf de coton ou fibres synthétiques ou artificielles);Slips und andere Unterhosen, aus Gewirken oder Gestricken aus Spinnstoffen, für Männer oder Knaben (ausg. aus Baumwolle oder Chemiefasern)
4;610721000010;;- Camisones y pijamas;;;
5;610721000080;6107.21;-- De algodón;Men's or boys' nightshirts and pyjamas of cotton, knitted or crocheted (excl. vests and singlets);Chemises de nuit et pyjamas, en bonneterie, de coton, pour hommes ou garçonnets (sauf maillots de corps);Nachthemden und Schlafanzüge, aus Gewirken oder Gestricken aus Baumwolle, für Männer oder Knaben (ausg. Unterhemden)
5;610722000080;6107.22;-- De fibras sintéticas o artificiales;Men's or boys' nightshirts and pyjamas of man-made fibres, knitted or crocheted (excl. vests and singlets);Chemises de nuit et pyjamas, en bonneterie, de fibres synthétiques ou artificielles, pour hommes ou garçonnets (sauf maillots de corps);Nachthemden und Schlafanzüge, aus Gewirken oder Gestricken aus Chemiefasern, für Männer oder Knaben (ausg. Unterhemden)
5;610729000080;6107.29;-- De las demás materias textiles;Men's or boys' nightshirts and pyjamas of textile materials, knitted or crocheted (excl. of cotton or man-made fibres, and vests and singlets);Chemises de nuit et pyjamas, en bonneterie, de matières textiles, pour hommes ou garçonnets (sauf de coton, fibres synthétiques ou artificielles et sauf maillots de corps);Nachthemden und Schlafanzüge, aus Gewirken oder Gestricken aus Spinnstoffen, für Männer oder Knaben (ausg. aus Baumwolle oder Chemiefasern sowie Unterhemden)
4;610791000010;;- Los demás;;;
5;610791000080;6107.91;-- De algodón;Men's or boys' bathrobes, dressing gowns and similar articles of cotton, knitted or crocheted;Peignoirs de bain, robes de chambre et articles simil., en bonneterie, de coton, pour hommes ou garçonnets;Bademäntel und Badejacken, Hausmäntel und ähnl. Waren, aus Gewirken oder Gestricken aus Baumwolle, für Männer oder Knaben
5;610799000080;6107.99;-- De las demás materias textiles;Men's or boys' bathrobes, dressing gowns and similar articles of textile materials, knitted or crocheted (excl. of cotton);Peignoirs de bain, robes de chambre et articles simil., en bonneterie, de matières textiles, pour hommes ou garçonnets (sauf de coton);Bademäntel und Badejacken, Hausmäntel und ähnl. Waren, aus Gewirken oder Gestricken aus Spinnstoffen, für Männer oder Knaben (ausg. aus Baumwolle)
