5;570232000080;5702.32;-- De materia textil sintética o artificial;Carpets and other floor coverings, of man-made textile materials, woven, not tufted or flocked, of pile construction, not made up (excl. Kelem, Schumacks, Karamanie and similar hand-woven rugs);Tapis et autres revêtements de sol, de matières textiles synthétiques ou artificielles, tissés, non-touffetés ni floqués, à velours, non-confectionnés (à l'excl. des tapis dits 'kelim', 'kilim', 'schumacks', 'soumak' ou 'karamanie' ainsi que des tapis simil. tissés à la main);Teppiche und andere Fußbodenbeläge, aus synthetischen oder künstlichen Spinnstoffen, gewebt, weder getuftet noch beflockt, mit Flor, unkonfektioniert (ausg. Kelim, Sumak, Karamanie und ähnl. handgewebte Teppiche)
5;570239000080;5702.39;-- De las demás materias textiles;"Carpets and other floor coverings, of vegetable textile materials or coarse animal hair, woven, not tufted or flocked, of pile construction, not made up (excl. Kelem, Schumacks, Karamanie and similar hand-woven rugs, and floor coverings of coconut fibres ""coir"")";Tapis et autres revêtements de sol, de matières textiles végétales ou de poils grossiers, tissés, non-touffetés ni floqués, à velours, non-confectionnés (à l'excl. des revêtements de sol en coco et des tapis dits 'kelim', 'kilim', 'schumacks', 'soumak' ou 'karamanie' ainsi que des tapis simil. tissés à la main);Teppiche und andere Fußbodenbeläge, aus pflanzlichen Spinnstoffen oder aus groben Tierhaaren, gewebt, weder getuftet noch beflockt, mit Flor, unkonfektioniert (ausg. Kelim, Sumak, Karamanie und ähnl. handgewebte Teppiche sowie Fußbodenbeläge aus Kokosfasern)
4;570241000010;;- Los demás, aterciopelados, confeccionados;;;
5;570241000080;5702.41;-- De lana o pelo fino;Carpets and other floor coverings, of wool or fine animal hair, woven, not tufted or flocked, of pile construction, made up (excl. Kelem, Schumacks, Karamanie and similar hand-woven rugs);Tapis et autres revêtements de sol, de laine ou de poils fins, tissés, non-touffetés ni floqués, à velours, confectionnés (à l'excl. des tapis dits 'kelim', 'kilim', 'schumacks', 'soumak' ou 'karamanie' et des tapis simil. tissés à la main);Teppiche und andere Fußbodenbeläge, aus Wolle oder feinen Tierhaaren, gewebt, weder getuftet noch beflockt, mit Flor, konfektioniert (ausg. Kelim, Sumak, Karamanie und ähnl. handgewebte Teppiche)
5;570242000080;5702.42;-- De materia textil sintética o artificial;Carpets and other floor coverings, of man-made textile materials, woven, not tufted or flocked, of pile construction, made up (excl. Kelem, Schumacks, Karamanie and similar hand-woven rugs);Tapis et autres revêtements de sol, de matières synthétiques ou artificielles, tissés, non-touffetés ni floqués, à velours, confectionnés (à l'excl. des tapis dits 'kelim', 'kilim', 'schumacks', 'soumak' ou 'karamanie' et des tapis simil. tissés à la main);Teppiche und andere Fußbodenbeläge, aus synthetischen oder künstlichen Spinnstoffen, gewebt, weder getuftet noch beflockt, mit Flor, konfektioniert (ausg. Kelim, Sumak, Karamanie und ähnl. handgewebte Teppiche)
5;570249000080;5702.49;-- De las demás materias textiles;"Carpets and other floor coverings, of vegetable textile materials or coarse animal hair, woven, not tufted or flocked, of pile construction, made up (excl. Kelem, Schumacks, Karamanie and similar hand-woven rugs, and floor coverings of coconut fibres ""coir"")";Tapis et autres revêtements de sol, de matières textiles végétales ou de poils grossiers, tissés, non-touffetés ni floqués, à velours, confectionnés (à l'excl. des revêtements de sol en coco ainsi que des tapis dits 'kelim', 'kilim', 'schumacks', 'soumak' ou 'karamanie' et des tapis simil. tissés à la main);Teppiche und andere Fußbodenbeläge, aus pflanzlichen Spinnstoffen oder aus groben Tierhaaren, gewebt, weder getuftet noch beflockt, mit Flor, konfektioniert (ausg. Kelim, Sumak, Karamanie und ähnl. handgewebte Teppiche sowie Fußbodenbeläge aus Kokosfasern)
4;570250000080;5702.50;- Los demás, sin aterciopelar ni confeccionar;"Carpets and other textile floor coverings, woven, not tufted or flocked, not of pile construction, not made up (excl. Kelem, Schumacks, Karamanie and similar hand-woven rugs, and floor coverings of coconut fibres ""coir"")";Tapis et autres revêtements de sol, en matières textiles, tissés, non-touffetés ni floqués, sans velours, non-confectionnés (à l'excl. des tapis dits 'kelim', 'kilim', 'schumacks', 'soumak' ou 'karamanie' et des tapis simil. tissés à la main);Teppiche und andere Fußbodenbeläge, aus Spinnstoffen, gewebt, weder getuftet noch beflockt, ohne Flor, unkonfektioniert (ausg. Kelim, Sumak, Karamanie und ähnl. handgewebte Teppiche)
4;570291000010;;- Los demás, sin aterciopelar, confeccionados;;;
5;570291000080;5702.91;-- De lana o pelo fino;Carpets and other floor coverings, of wool or fine animal hair, woven, not tufted or flocked, not of pile construction, made up (excl. Kelem, Schumacks, Karamanie and similar hand-woven rugs);Tapis et autres revêtements de sol, de laine ou de poils fins, tissés, non-touffetés ni floqués, sans velours, confectionnés (à l'excl. des tapis dits 'kelim', 'kilim', 'schumacks', 'soumak' ou 'karamanie' et des tapis simil. tissés à la main);Teppiche und andere Fußbodenbeläge, aus Wolle oder feinen Tierhaaren, gewebt, weder getuftet noch beflockt, ohne Flor, konfektioniert (ausg. Kelim, Sumak, Karamanie und ähnl. handgewebte Teppiche)
5;570292000080;5702.92;-- De materia textil sintética o artificial;Carpets and other floor coverings, of man-made textile materials, woven, not tufted or flocked, not of pile construction, made up (excl. Kelem, Schumacks, Karamanie and similar hand-woven rugs);Tapis et autres revêtements de sol, de matières textiles synthétiques ou artificielles, tissés, non-touffetés ni floqués, sans velours, confectionnés (à l'excl. des tapis dits 'kelim', 'kilim', 'schumacks', 'soumak' ou 'karamanie' et des tapis simil. tissés à la main);Teppiche und andere Fußbodenbeläge, aus synthetischen oder künstlichen Spinnstoffen, gewebt, weder getuftet noch beflockt, ohne Flor, konfektioniert (ausg. Kelim, Sumak, Karamanie und ähnl. handgewebte Teppiche)
5;570299000080;5702.99;-- De las demás materias textiles;"Carpets and other floor coverings, of vegetable textile materials or coarse animal hair, woven, not tufted or flocked, not of pile construction, made up (excl. Kelem, Schumacks, Karamanie and similar hand-woven rugs, and floor coverings of coconut fibres ""coir"")";Tapis et autres revêtements de sol, de matières textiles végétales ou de poils grossiers, tissés, non-touffetés ni floqués, sans velours, confectionnés (à l'excl. des revêtements de sol en coco ainsi que des tapis dits 'kelim', 'kilim', 'schumacks', 'soumak' ou 'karamanie' et des tapis simil. tissés à la main);Teppiche und andere Fußbodenbeläge, aus pflanzlichen Spinnstoffen oder aus groben Tierhaaren, gewebt, weder getuftet noch beflockt, ohne Flor, konfektioniert (ausg. Kelim, Sumak, Karamanie und ähnl. handgewebte Teppiche sowie Fußbodenbeläge aus Kokosfasern)
3;570300000080;57.03; Alfombras y demás revestimientos para el suelo, de materia textil, con mechón insertado, incluso confeccionados;"Carpets and other textile floor coverings, tufted ""needle punched"", whether or not made up";Tapis et autres revêtements de sol en matières textiles, touffetés, même confectionnés;"Teppiche und andere Fußbodenbeläge, aus Spinnstoffen, getuftet ""Nadelflor"", auch konfektioniert"
4;570310000080;5703.10;- De lana o pelo fino;"Carpets and other floor coverings, of wool or fine animal hair, tufted ""needle punched"", whether or not made up";Tapis et autres revêtements de sol, de laine ou de poils fins, touffetés, même confectionnés;"Teppiche und andere Fußbodenbeläge, aus Wolle oder feinen Tierhaaren, getuftet ""Nadelflor"", auch konfektioniert"
4;570320000080;5703.20;- De nailon o demás poliamidas;"Carpets and other floor coverings, of nylon or other polyamides, tufted ""needle punched"", whether or not made up";Tapis et autres revêtements de sol, de nylon ou d'autres polyamides, touffetés, même confectionnés;"Teppiche und andere Fußbodenbeläge, aus Nylon oder anderen Polyamiden, getuftet ""Nadelflor"", auch konfektioniert"
4;570330000080;5703.30;- De las demás materias textiles sintéticas o de materia textil artificial;"Carpets and other floor coverings, of man-made textile materials, tufted ""needle punched"", whether or not made up (excl. those of nylon or other polyamides)";Tapis et autres revêtements de sol, de matières textiles synthétiques ou artificielles, touffetés, même confectionnés (à l'excl. des articles en nylon ou en autres polyamides);"Teppiche und andere Fußbodenbeläge, aus synthetischen oder künstlichen Spinnstoffen, getuftet ""Nadelflor"", auch konfektioniert (ausg. aus Nylon oder anderen Polyamiden)"
4;570390000080;5703.90;- De las demás materias textiles;"Carpet tiles of vegetable textile materials or coarse animal hair, tufted ""needle punched"", whether or not made up";Tapis et autres revêtements de sol, de matières textiles végétales ou de poils grossiers, touffetés, même confectionnés;"Teppiche und andere Fußbodenbeläge, aus pflanzlichen Spinnstoffen oder aus groben Tierhaaren, getuftet ""Nadelflor"", auch konfektioniert"
3;570400000080;57.04; Alfombras y demás revestimientos para el suelo, de fieltro (excepto los de mechón insertado y los flocados), incluso confeccionados;Carpets and other floor coverings, of felt, not tufted or flocked, whether or not made up;Tapis et autres revêtements de sol, en feutre, non-touffetés ni floqués, même confectionnés;Teppiche und andere Fußbodenbeläge, aus Filz, weder getuftet noch beflockt, auch konfektioniert
4;570410000080;5704.10;- De superficie inferior o igual a 0,3 m²;Floor tiles, of felt, not tufted or flocked, with an area of <= 0,3 m²;Carreaux, en feutre, non-touffetés ni floqués, d'une superficie <= 0,3 m²;Bodenfliesen aus Filz, weder getuftet noch beflockt, mit einer Oberfläche von <= 0,3 m²
4;570490000080;5704.90;- Los demás;Carpets and other floor coverings, of felt, not tufted or flocked, whether or not made up (excl. floor tiles with an area of <= 0,3 m²);Tapis et autres revêtements de sol, en feutre, non-touffetés ni floqués, même confectionnés (à l'excl. des carreaux d'une superficie <= 0,3 m²);Teppiche und andere Fußbodenbeläge, aus Filz, weder getuftet noch beflockt, auch konfektioniert (ausg. Fliesen mit einer Oberfläche von <= 0,3 m²)
3;570500000080;5705.00; Las demás alfombras y revestimientos para el suelo, de materia textil, incluso confeccionados;"Carpets and other textile floor coverings, whether or not made up (excl. knotted, woven or tufted ""needle punched"", and of felt)";Tapis et autres revêtements de sol en matières textiles, même confectionnés (à l'excl. à points noués ou enroulés, tissés, touffetés ou en feutre);Teppiche und andere Fußbodenbeläge, aus Spinnstoffen, auch konfektioniert (ausg. geknüpft, gewebt oder getuftet [Nadelflor] sowie aus Filz)
2;580021000090;58;" CAPÍTULO 58 - TEJIDOS ESPECIALES; SUPERFICIES TEXTILES CON MECHÓN INSERTADO; ENCAJES; TAPICERÍA; PASAMANERÍA; BORDADOS";"SPECIAL WOVEN FABRICS; TUFTED TEXTILE FABRICS; LACE; TAPESTRIES; TRIMMINGS; EMBROIDERY";"TISSUS SPÉCIAUX; SURFACES TEXTILES TOUFFETÉES; DENTELLES; TAPISSERIES; PASSEMENTERIES; BRODERIES";"SPEZIALGEWEBE; GETUFTETE SPINNSTOFFERZEUGNISSE; SPITZEN; TAPISSERIEN; POSAMENTIERWAREN; STICKEREIEN"
3;580100000080;58.01; Terciopelo y felpa (excepto los de punto), y tejidos de chenilla (excepto los productos de las partidas 5802 o 5806);Woven pile fabrics and chenille fabrics (excl. terry towelling and similar woven terry fabrics, tufted textile fabrics and narrow woven fabrics of heading 5806);Velours et peluches tissés et tissus de chenille (à l'excl. des tissus bouclés du genre éponge, des surfaces textiles touffetées ainsi que des articles de rubanerie du n° 5806);Samt und Plüsch, gewebt, und Chenillegewebe (ausg. Schlingengewebe nach Art der Frottiergewebe, getuftete Spinnstofferzeugnisse sowie Bänder der Pos. 5806)
4;580110000080;5801.10;- De lana o pelo fino;Woven pile fabrics and chenille fabrics, of wool or fine animal hair (excl. terry towelling and similar woven terry fabrics, tufted textile fabrics and narrow woven fabrics of heading 5806);Velours et peluches tissés et tissus de chenille, de laine ou de poils fins (à l'excl. des tissus bouclés du genre éponge, des surfaces textiles touffetées ainsi que des articles de rubanerie du n° 5806);Samt und Plüsch, gewebt, und Chenillegewebe, aus Wolle oder feinen Tierhaaren (ausg. Schlingengewebe nach Art der Frottiergewebe, getuftete Spinnstofferzeugnisse sowie Bänder der Pos. 5806)
4;580121000010;;- De algodón;;;
5;580121000080;5801.21;-- Terciopelo y felpa por trama, sin cortar;Uncut weft pile fabrics, of cotton (excl. terry towelling and similar woven terry fabrics, tufted textile fabrics and narrow woven fabrics of heading 5806);Velours et peluches par la trame, non-coupés, de coton (à l'excl. des tissus bouclés du genre éponge, des surfaces textiles touffetées ainsi que des articles de rubanerie du n° 5806);Schusssamt und Schusssplüsch, unaufgeschnitten, aus Baumwolle (ausg. Schlingengewebe nach Art der Frottiergewebe, getuftete Spinnstofferzeugnisse sowie Bänder der Pos. 5806)
5;580122000080;5801.22;-- Terciopelo y felpa por trama, cortados, rayados (pana rayada, corduroy);Cut corduroy, of cotton (excl. terry towelling and similar woven terry fabrics, tufted textile fabrics and narrow woven fabrics of heading 5806);Velours et peluches par la trame, coupés, côtelés, de coton (à l'excl. des tissus bouclés du genre éponge, des surfaces textiles touffetées ainsi que des articles de rubanerie du n° 5806);Rippenschusssamt und Rippenschussplüsch, aufgeschnitten, aus Baumwolle (ausg. Schlingengewebe nach Art der Frottiergewebe, getuftete Spinnstofferzeugnisse sowie Bänder der Pos. 5806)
5;580123000080;5801.23;-- Los demás terciopelos y felpas por trama;Cut weft pile fabrics, of cotton (excl. terry towelling and similar woven terry fabrics, tufted textile fabrics and narrow woven fabrics of heading 5806);Velours et peluches par la trame, coupés, de coton (à l'excl. des tissus bouclés du genre éponge, des surfaces textiles touffetées ainsi que des articles de rubanerie du n° 5806);Schusssamt und Schusssplüsch, aufgeschnitten, aus Baumwolle (ausg. Schlingengewebe nach Art der Frottiergewebe, getuftete Spinnstofferzeugnisse sowie Bänder der Pos. 5806)
5;580126000080;5801.26;-- Tejidos de chenilla;Chenille fabrics, of cotton (excl. terry towelling and similar woven terry fabrics, tufted textile fabrics and narrow woven fabrics of heading 5806);Tissus de chenille, de coton (à l'excl. des tissus bouclés du genre éponge, des surfaces textiles touffetées ainsi que des articles de rubanerie du n° 5806);Chenillegewebe aus Baumwolle (ausg. Schlingengewebe nach Art der Frottiergewebe, getuftete Spinnstofferzeugnisse sowie Bänder der Pos. 5806)
5;580127000080;5801.27;-- Terciopelo y felpa por urdimbre;Warp pile fabrics, of cotton (excl. terry towelling and similar woven terry fabrics, tufted textile fabrics and narrow woven fabrics of heading 5806);Velours et peluches par la chaîne, de coton (à l'excl. des tissus bouclés du genre éponge, des surfaces textiles touffetées ainsi que des articles de rubanerie du no 5806);Kettsamt und Kettplüsch, aus Baumwolle (ausg. Schlingengewebe nach Art der Frottiergewebe, getuftete Spinnstofferzeugnisse sowie Bänder der Position 5806)
4;580131000010;;- De fibras sintéticas o artificiales;;;
5;580131000080;5801.31;-- Terciopelo y felpa por trama, sin cortar;Uncut weft pile fabrics, of man-made fibres (excl. terry towelling and similar woven terry fabrics, tufted textile fabrics and narrow woven fabrics of heading 5806);Velours et peluches par la trame, non-coupés, de fibres synthétiques ou artificielles (à l'excl. des tissus bouclés du genre éponge, des surfaces textiles touffetées ainsi que des articles de rubanerie du n° 5806);Schusssamt und Schusssplüsch, unaufgeschnitten, aus Chemiefasern (ausg. Schlingengewebe nach Art der Frottiergewebe, getuftete Spinnstofferzeugnisse sowie Bänder der Pos. 5806)
5;580132000080;5801.32;-- Terciopelo y felpa por trama, cortados, rayados (pana rayada, corduroy);Cut corduroy, of man-made fibres (excl. terry towelling and similar woven terry fabrics, tufted textile fabrics and narrow woven fabrics of heading 5806);Velours et peluches par la trame, coupés, côtelés, de fibres synthétiques ou artificielles (à l'excl. des tissus bouclés du genre éponge, des surfaces textiles touffetées ainsi que des articles de rubanerie du n° 5806);Rippenschusssamt und Rippenschussplüsch, aufgeschnitten, aus Chemiefasern (ausg. Schlingengewebe nach Art der Frottiergewebe, getuftete Spinnstofferzeugnisse sowie Bänder der Pos. 5806)
5;580133000080;5801.33;-- Los demás terciopelos y felpas por trama;Cut weft pile fabrics, of man-made fibres (excl. terry towelling and similar woven terry fabrics, tufted textile fabrics and narrow woven fabrics of heading 5806);Velours et peluches par la trame, coupés, de fibres synthétiques ou artificielles (à l'excl. des tissus bouclés du genre éponge, des surfaces textiles touffetées ainsi que des articles de rubanerie du n° 5806);Schusssamt und Schusssplüsch, aufgeschnitten, aus Chemiefasern (ausg. Schlingengewebe nach Art der Frottiergewebe, getuftete Spinnstofferzeugnisse sowie Bänder der Pos. 5806)
5;580136000080;5801.36;-- Tejidos de chenilla;Chenille fabrics, of man-made fibres (excl. terry towelling and similar woven terry fabrics, tufted textile fabrics and narrow woven fabrics of heading 5806);Tissus de chenille, de fibres synthétiques ou artificielles (à l'excl. des tissus bouclés du genre éponge, des surfaces textiles touffetées ainsi que des articles de rubanerie du no 5806);Chenillegewebe aus Chemiefasern (ausg. Schlingengewebe nach Art der Frottiergewebe, getuftete Spinnstofferzeugnisse sowie Bänder der Position 5806)
5;580137000080;5801.37;-- Terciopelo y felpa por urdimbre;Warp pile fabrics, of man-made fibres (excl. terry towelling and similar woven terry fabrics, tufted textile fabrics and narrow woven fabrics of heading 5806);Velours et peluches par la chaîne, de fibres synthétiques ou artificielles (à l'excl. des tissus bouclés du genre éponge, des surfaces textiles touffetées ainsi que des articles de rubanerie du no 5806);Kettsamt und Kettplüsch, aus Chemiefasern (ausg. Schlingengewebe nach Art der Frottiergewebe, getuftete Spinnstofferzeugnisse sowie Bänder der Position 5806)
4;580190000080;5801.90;- De las demás materias textiles;Woven pile fabrics and chenille fabrics (excl. those of man-made fibres, wool or fine animal hair, terry towelling and similar woven terry fabrics, tufted textile fabrics and narrow woven fabrics of heading 5806);Velours et peluches tissés et tissus de chenille (à l'excl. des tissus bouclés du genre éponge, des surfaces textiles touffetées, des articles de rubanerie du n° 5806 et des articles de laine, de poils fins ou de fibres synthétiques ou artificielles);Samt und Plüsch, gewebt, und Chenillegewebe (ausg. aus Chemiefasern, Wolle oder feinen Tierhaaren, Baumwolle sowie Schlingengewebe nach Art der Frottiergewebe, getuftete Spinnstofferzeugnisse und Bänder der Pos. 5806)
3;580200000080;58.02;" Tejidos con bucles del tipo toalla (excepto los productos de la partida 5806); superficies textiles con mechón insertado (excepto los productos de la partida 5703)";Terry towelling and similar woven terry fabrics, tufted textile fabrics (excl. narrow woven fabrics of heading 5806, carpets and other floor coverings);Tissus bouclés du genre éponge et surfaces textiles touffetées (à l'excl. des articles de rubanerie du n° 5806 ainsi que des tapis et autres revêtements de sol du n° 5703);Schlingengewebe nach Art der Frottiergewebe sowie getuftete Spinnstofferzeugnisse (ausg. Bänder der Pos. 5806 sowie Teppiche und andere Fußbodenbeläge)
4;580211000010;;- Tejidos con bucles del tipo toalla, de algodón;;;
5;580211000080;5802.11;-- Crudos;Terry towelling and similar woven terry fabrics, of cotton, unbleached (excl. narrow woven fabrics of heading 5806, carpets and other floor coverings);Tissus bouclés du genre éponge, en coton, écrus (à l'excl. des articles de rubanerie du n° 5806 ainsi que des tapis et autres revêtements de sol du n° 5703);Schlingengewebe nach Art der Frottiergewebe, aus Baumwolle, roh (ausg. Bänder der Pos. 5806 sowie Teppiche und andere Fußbodenbeläge)
5;580219000080;5802.19;-- Los demás;Terry towelling and similar woven terry fabrics, of cotton (excl. unbleached, narrow woven fabrics of heading 5806, carpets and other floor coverings);Tissus bouclés du genre éponge, en coton (à l'excl. des tissus écrus, des articles de rubanerie du n° 5806 ainsi que des tapis et autres revêtements de sol du n° 5703);Schlingengewebe nach Art der Frottiergewebe, aus Baumwolle (ausg. roh sowie Bänder der Pos. 5806 und Teppiche und andere Fußbodenbeläge)
4;580220000080;5802.20;- Tejidos con bucles del tipo toalla, de las demás materias textiles;Terry towelling and similar woven terry fabrics (excl. those of cotton, narrow woven fabrics of heading 5806, carpets and other floor coverings);Tissus bouclés du genre éponge (à l'excl. des tissus en coton, des articles de rubanerie du n° 5806 ainsi que des tapis et autres revêtements de sol du n° 5703);Schlingengewebe nach Art der Frottiergewebe (ausg. aus Baumwolle sowie Bänder der Pos. 5806 und Teppiche und andere Fußbodenbeläge)
4;580230000080;5802.30;- Superficies textiles con mechón insertado;Tufted textile fabrics (excl. carpets and other floor coverings);Surfaces textiles touffetées (à l'excl. des tapis et autres revêtements de sol du n° 5703);Spinnstofferzeugnisse, getuftet (ausg. Teppiche und andere Fußbodenbeläge)
3;580300000080;5803.00; Tejidos de gasa de vuelta (excepto los productos de la partida 5806);Gauze (excl. narrow woven fabrics of heading 5806);Tissus à point de gaze (à l'excl. des articles de rubanerie du n° 5806);Drehergewebe (ausg. Bänder der Pos. 5806)
3;580400000080;58.04;" Tul, tul-bobinot y tejidos de mallas anudadas; encajes en pieza, en tiras o en aplicaciones (excepto los productos de las partidas 6002 a 6006)";"Tulles and other net fabrics (excl. woven, knitted or crocheted fabrics); lace in the piece, in strips or in motifs (excl. fabrics of heading 6002 to 6006)";"Tulles, tulles-bobinots et tissus à mailles nouées; dentelles en pièces, en bandes ou en motifs (à l'excl. des produits du n° 6002 à 6006)";"Tülle ""einschl. Bobinetgardinenstoffe"" und geknüpfte Netzstoffe; Spitzen als Meterware, Streifen oder als Motive (ausg. Erzeugnisse der Pos. 6002 bis 6006)"
4;580410000080;5804.10;- Tul, tul-bobinot y tejidos de mallas anudadas;Tulles and other net fabrics (excl. woven, knitted or crocheted fabrics);Tulles, tulles-bobinots et tissus à mailles nouées;"Tülle ""einschl. Bobinetgardinenstoffe"" und geknüpfte Netzstoffe"
4;580421000010;;- Encajes fabricados a máquina;;;
5;580421000080;5804.21;-- De fibras sintéticas o artificiales;Mechanically made lace of man-made fibres in the piece, in strips or in motifs (excl. fabrics of heading 6002 to 6006);Dentelles à la mécanique, de fibres synthétiques ou artificielles, en pièces, en bandes ou en motifs (à l'excl. des produits du n° 6002 à 6006);Spitzen, als Meterware, Streifen oder als Motive, maschinengefertigt, aus Chemiefasern (ausg. Erzeugnisse der Pos. 6002 bis 6006)
5;580429000080;5804.29;-- De las demás materias textiles;Mechanically made lace in the piece, in strips or in motifs (excl. that of man-made fibres and fabrics of heading 6002 to 6006);Dentelles à la mécanique, en pièces, en bandes ou en motifs (à l'excl. des articles de fibres synthétiques ou artificielles ainsi que des produits du n° 6002 à 6006);Spitzen, als Meterware, Streifen oder als Motive, maschinengefertigt (ausg. aus Chemiefasern und Erzeugnissen der Pos. 6002 bis 6006)
4;580430000080;5804.30;- Encajes hechos a mano;Handmade lace in the piece, in strips or in motifs (excl. fabrics of heading 6002 to 6006);Dentelles à la main, en pièces, en bandes ou en motifs (à l'excl. des produits du n° 6002 à 6006);Spitzen, als Meterware, Streifen oder als Motive, handgefertigt (ausg. Erzeugnisse der Pos. 6002 bis 6006)
3;580500000080;5805.00; Tapicería tejida a mano (gobelinos, Flandes, Aubusson, Beauvais y similares) y tapicería de aguja (por ejemplo: de petit point, de punto de cruz), incluso confeccionadas;Hand-woven tapestries of the type Gobelin, Flanders, Aubusson, Beauvais and the like, and needle-worked tapestries, e.g. petit point, cross-stitch, whether or not made up (excl. Kelem, Schumacks, Karamanie and the like, and tapestries > 100 years old);Tapisseries tissées à la main [genre Gobelins, Flandres, Aubusson, Beauvais et simil.] et tapisseries à l'aiguille [au petit point, au point de croix, p.ex.], même confectionnées (à l'excl. des tapisseries ayant > 100 ans d'âge ainsi que des tapis dits 'kelim', 'kilim', 'schumacks', 'soumak' ou 'karamanie' ainsi que des tapis simil.);"Tapisserien, handgewebt ""Gobelins, Flandrische Gobelins, Aubusson, Beauvais und ähnl."", und Tapisserien als Nadelarbeit ""z.B. Petit Point-, Kreuzstich"", auch konfektioniert (ausg. Kelim, Sumak, Karamanie und ähnl. Teppiche sowie Tapisserien mit einem Alter von > 100 Jahren)"
